[
  {
    "schema": "relatte.receipt/v0",
    "crossing_id": "bootstrap:genesis",
    "world_id": "fe6932a8-9f44-4a3e-84d8-a2c547f527dc",
    "receiver_particular": "fe6932a8-9f44-4a3e-84d8-a2c547f527dc",
    "kind": "RECEIVED",
    "semantic_effect": "none",
    "created_at": "2026-10-07T00:00:00.000Z",
    "extensions": {
      "bootstrap_journal": {
        "schema": "relatte.bootstrap-journal/v0",
        "admin_id": "fe6932a8-9f44-4a3e-84d8-a2c547f527dc",
        "kind": "GENESIS",
        "parent": null,
        "data": {
          "scope": "SOVEREIGN_LOCAL_ROOT",
          "constitution_nonce": "8f56a7de-0d38-4f23-b30b-e5dbd19a6aff"
        }
      }
    },
    "receipt_id": "relatte-receipt-v0:c689ce7ac2a90c792f6f2f56e89b4a3cddbc57ae0a82ccbce2c377f2c5cc4a9b",
    "signing": {
      "algorithm": "ECDSA-P256-SHA256",
      "public_key": {
        "kty": "EC",
        "crv": "P-256",
        "x": "rE9xVpbcU6DR2Av6KgeYZEMzrnWtlFujD4xKjEa0UGk",
        "y": "f9-gxwJNbCWdIEdfUDdngbsPD8pRtngB-L1ZlDVWOB4"
      },
      "signature": "IuWv89-z16M1BWrHEydLxZyDecDx8dmH4tPZnak-MNWp9AmCYUaoXhWUYbeS16M5F4JB7wpiOw9TeHtfaxm85w",
      "domain": "relatte.receipt-signature/v0"
    }
  },
  {
    "schema": "relatte.receipt/v0",
    "crossing_id": "relatte-receipt-v0:c689ce7ac2a90c792f6f2f56e89b4a3cddbc57ae0a82ccbce2c377f2c5cc4a9b",
    "world_id": "fe6932a8-9f44-4a3e-84d8-a2c547f527dc",
    "receiver_particular": "fe6932a8-9f44-4a3e-84d8-a2c547f527dc",
    "kind": "RECEIVED",
    "semantic_effect": "none",
    "created_at": "2026-10-07T00:00:00.000Z",
    "extensions": {
      "bootstrap_journal": {
        "schema": "relatte.bootstrap-journal/v0",
        "admin_id": "fe6932a8-9f44-4a3e-84d8-a2c547f527dc",
        "kind": "DELEGATE_POLICY",
        "parent": "relatte-receipt-v0:c689ce7ac2a90c792f6f2f56e89b4a3cddbc57ae0a82ccbce2c377f2c5cc4a9b",
        "data": {
          "policy_key": "ba2481ad1da43768ac0175ba3e5019f1a33821f46e56b738915818159361aaac",
          "slot": "e7d2cb2b-698f-483c-9d4c-4802a44febff",
          "version": 1,
          "scope": "ONE_DECLARED_POLICY_SLOT"
        }
      }
    },
    "receipt_id": "relatte-receipt-v0:7741f2de8ac44839fbddb95f4b1301fc933736df0505f58f8d0f16ea515127ad",
    "signing": {
      "algorithm": "ECDSA-P256-SHA256",
      "public_key": {
        "kty": "EC",
        "crv": "P-256",
        "x": "rE9xVpbcU6DR2Av6KgeYZEMzrnWtlFujD4xKjEa0UGk",
        "y": "f9-gxwJNbCWdIEdfUDdngbsPD8pRtngB-L1ZlDVWOB4"
      },
      "signature": "YdMl6YMmc5rHUH1zvvX_mjmAFNyIUTVI4xrB_Yi-LSl93PzWrGHVhF7UbESqzeZ9DLwPvcQOvttHhS4O7NHmkg",
      "domain": "relatte.receipt-signature/v0"
    }
  },
  {
    "schema": "relatte.receipt/v0",
    "crossing_id": "relatte-receipt-v0:7741f2de8ac44839fbddb95f4b1301fc933736df0505f58f8d0f16ea515127ad",
    "world_id": "fe6932a8-9f44-4a3e-84d8-a2c547f527dc",
    "receiver_particular": "fe6932a8-9f44-4a3e-84d8-a2c547f527dc",
    "kind": "RECEIVED",
    "semantic_effect": "none",
    "created_at": "2026-10-07T00:00:00.000Z",
    "extensions": {
      "bootstrap_journal": {
        "schema": "relatte.bootstrap-journal/v0",
        "admin_id": "fe6932a8-9f44-4a3e-84d8-a2c547f527dc",
        "kind": "SELECT_POLICY",
        "parent": "relatte-receipt-v0:7741f2de8ac44839fbddb95f4b1301fc933736df0505f58f8d0f16ea515127ad",
        "data": {
          "claim_id": "relatte-receipt-v0:cfaf1f269940e932f49c3d72f08dd1dadd93f06aef9015a7aabe6947aadb6f4f"
        }
      }
    },
    "receipt_id": "relatte-receipt-v0:b0c5b4d3261bf5dcc33ab4b73c298c5d6503444e0f97a594b851d15cc41f0203",
    "signing": {
      "algorithm": "ECDSA-P256-SHA256",
      "public_key": {
        "kty": "EC",
        "crv": "P-256",
        "x": "rE9xVpbcU6DR2Av6KgeYZEMzrnWtlFujD4xKjEa0UGk",
        "y": "f9-gxwJNbCWdIEdfUDdngbsPD8pRtngB-L1ZlDVWOB4"
      },
      "signature": "F9RgX_8TcIIe_rsjoU82_ih8bce-23OuD6IT7pB2SsOXh2h7_sRPTn0QG2F1neXcTsHPXdXQ2TvIq_oMBr56mA",
      "domain": "relatte.receipt-signature/v0"
    }
  },
  {
    "schema": "relatte.receipt/v0",
    "crossing_id": "relatte-receipt-v0:b0c5b4d3261bf5dcc33ab4b73c298c5d6503444e0f97a594b851d15cc41f0203",
    "world_id": "fe6932a8-9f44-4a3e-84d8-a2c547f527dc",
    "receiver_particular": "fe6932a8-9f44-4a3e-84d8-a2c547f527dc",
    "kind": "RECEIVED",
    "semantic_effect": "none",
    "created_at": "2026-10-07T00:00:00.000Z",
    "extensions": {
      "bootstrap_journal": {
        "schema": "relatte.bootstrap-journal/v0",
        "admin_id": "fe6932a8-9f44-4a3e-84d8-a2c547f527dc",
        "kind": "OBSERVE_CONFLICT",
        "parent": "relatte-receipt-v0:b0c5b4d3261bf5dcc33ab4b73c298c5d6503444e0f97a594b851d15cc41f0203",
        "data": {
          "claim_ids": [
            "relatte-receipt-v0:7e6ad7c64664a88c45a69abfcb67eb1fdb5d014f560f776699291a343ad60cae",
            "relatte-receipt-v0:cfaf1f269940e932f49c3d72f08dd1dadd93f06aef9015a7aabe6947aadb6f4f"
          ]
        }
      }
    },
    "receipt_id": "relatte-receipt-v0:fd515f2e767be3d2b5b7816f89b28e41cc97b51b8504cca8f0a14a54244b2f75",
    "signing": {
      "algorithm": "ECDSA-P256-SHA256",
      "public_key": {
        "kty": "EC",
        "crv": "P-256",
        "x": "rE9xVpbcU6DR2Av6KgeYZEMzrnWtlFujD4xKjEa0UGk",
        "y": "f9-gxwJNbCWdIEdfUDdngbsPD8pRtngB-L1ZlDVWOB4"
      },
      "signature": "ZOKQu86zI2f8XSAkrSH-bk0UCMd5VyKJG__sQUgJEuCjxLPU7bGHclip_dGTag6TfUap6ro-7ZDCI_GLkcOuMw",
      "domain": "relatte.receipt-signature/v0"
    }
  },
  {
    "schema": "relatte.receipt/v0",
    "crossing_id": "bootstrap:genesis",
    "world_id": "13c3133d-b0c1-43e3-8865-48ea21412a32",
    "receiver_particular": "13c3133d-b0c1-43e3-8865-48ea21412a32",
    "kind": "RECEIVED",
    "semantic_effect": "none",
    "created_at": "2026-10-07T00:00:00.000Z",
    "extensions": {
      "bootstrap_journal": {
        "schema": "relatte.bootstrap-journal/v0",
        "admin_id": "13c3133d-b0c1-43e3-8865-48ea21412a32",
        "kind": "GENESIS",
        "parent": null,
        "data": {
          "scope": "SOVEREIGN_LOCAL_ROOT",
          "constitution_nonce": "d93f954f-a6f4-4c48-849a-a3fa777f5126"
        }
      }
    },
    "receipt_id": "relatte-receipt-v0:ea01a92ee91be53504f2a1007f7a42784ab5f44af6731da53a003e966f221e7a",
    "signing": {
      "algorithm": "ECDSA-P256-SHA256",
      "public_key": {
        "kty": "EC",
        "crv": "P-256",
        "x": "fRECx7TAhydz3G8sMS4Q4hwTdqCHzCWNWuDGiR5TM78",
        "y": "HGZ0_pOMyeEdJ8yYgwDEF0szPPvgxZ3dnyYOtnTqXWA"
      },
      "signature": "04-tY2O264SdZ1plMXUqBVMr4n2pkFr2HFD3Q-Pv6em4xO7WdQK66u9SuUZalKEc0AikhDAAiPyMCGl_vfJVig",
      "domain": "relatte.receipt-signature/v0"
    }
  },
  {
    "schema": "relatte.receipt/v0",
    "crossing_id": "relatte-receipt-v0:ea01a92ee91be53504f2a1007f7a42784ab5f44af6731da53a003e966f221e7a",
    "world_id": "13c3133d-b0c1-43e3-8865-48ea21412a32",
    "receiver_particular": "13c3133d-b0c1-43e3-8865-48ea21412a32",
    "kind": "RECEIVED",
    "semantic_effect": "none",
    "created_at": "2026-10-07T00:00:00.000Z",
    "extensions": {
      "bootstrap_journal": {
        "schema": "relatte.bootstrap-journal/v0",
        "admin_id": "13c3133d-b0c1-43e3-8865-48ea21412a32",
        "kind": "DELEGATE_POLICY",
        "parent": "relatte-receipt-v0:ea01a92ee91be53504f2a1007f7a42784ab5f44af6731da53a003e966f221e7a",
        "data": {
          "policy_key": "ba2481ad1da43768ac0175ba3e5019f1a33821f46e56b738915818159361aaac",
          "slot": "e7d2cb2b-698f-483c-9d4c-4802a44febff",
          "version": 1,
          "scope": "ONE_DECLARED_POLICY_SLOT"
        }
      }
    },
    "receipt_id": "relatte-receipt-v0:2442da86c4fb00e5c329c3404c6acdae7996c5290ff3c7f17d179f6ed3424fc3",
    "signing": {
      "algorithm": "ECDSA-P256-SHA256",
      "public_key": {
        "kty": "EC",
        "crv": "P-256",
        "x": "fRECx7TAhydz3G8sMS4Q4hwTdqCHzCWNWuDGiR5TM78",
        "y": "HGZ0_pOMyeEdJ8yYgwDEF0szPPvgxZ3dnyYOtnTqXWA"
      },
      "signature": "W7mDfJCBk_G0fYE-yvch0BtSvXGUs_v7JeD3wPvGQhLtMT0UzNBoRCNqobRGA8zOHDubAKVrdCeF2KovEvTyJQ",
      "domain": "relatte.receipt-signature/v0"
    }
  },
  {
    "schema": "relatte.receipt/v0",
    "crossing_id": "relatte-receipt-v0:2442da86c4fb00e5c329c3404c6acdae7996c5290ff3c7f17d179f6ed3424fc3",
    "world_id": "13c3133d-b0c1-43e3-8865-48ea21412a32",
    "receiver_particular": "13c3133d-b0c1-43e3-8865-48ea21412a32",
    "kind": "RECEIVED",
    "semantic_effect": "none",
    "created_at": "2026-10-07T00:00:00.000Z",
    "extensions": {
      "bootstrap_journal": {
        "schema": "relatte.bootstrap-journal/v0",
        "admin_id": "13c3133d-b0c1-43e3-8865-48ea21412a32",
        "kind": "SELECT_POLICY",
        "parent": "relatte-receipt-v0:2442da86c4fb00e5c329c3404c6acdae7996c5290ff3c7f17d179f6ed3424fc3",
        "data": {
          "claim_id": "relatte-receipt-v0:7e6ad7c64664a88c45a69abfcb67eb1fdb5d014f560f776699291a343ad60cae"
        }
      }
    },
    "receipt_id": "relatte-receipt-v0:4a047ab3265791ef44e6f063dfcb6a50ec285fee4b08a047b09723338038ff40",
    "signing": {
      "algorithm": "ECDSA-P256-SHA256",
      "public_key": {
        "kty": "EC",
        "crv": "P-256",
        "x": "fRECx7TAhydz3G8sMS4Q4hwTdqCHzCWNWuDGiR5TM78",
        "y": "HGZ0_pOMyeEdJ8yYgwDEF0szPPvgxZ3dnyYOtnTqXWA"
      },
      "signature": "hQ_naknusrK4wZjQLymoLS2-L4XXnNCeCnwBu64HlGnjEa5k7ude6ZEW25U2I5u5QWi0ImmF9TeU_rwRkBNCDw",
      "domain": "relatte.receipt-signature/v0"
    }
  },
  {
    "schema": "relatte.receipt/v0",
    "crossing_id": "relatte-receipt-v0:4a047ab3265791ef44e6f063dfcb6a50ec285fee4b08a047b09723338038ff40",
    "world_id": "13c3133d-b0c1-43e3-8865-48ea21412a32",
    "receiver_particular": "13c3133d-b0c1-43e3-8865-48ea21412a32",
    "kind": "RECEIVED",
    "semantic_effect": "none",
    "created_at": "2026-10-07T00:00:00.000Z",
    "extensions": {
      "bootstrap_journal": {
        "schema": "relatte.bootstrap-journal/v0",
        "admin_id": "13c3133d-b0c1-43e3-8865-48ea21412a32",